{
  "$schema": "https://json-schema.org/draft/2020-12/schema",
  "type": "object",
  "$id": "rubric.schema.json",
  "schema_version": "1.0",
  "required": [
    "$schema",
    "schema_version",
    "rubric_version",
    "controls"
  ],
  "properties": {
    "$schema": {
      "type": "string",
      "minLength": 1
    },
    "schema_version": {
      "type": "string",
      "minLength": 1
    },
    "rubric_version": {
      "type": "string",
      "minLength": 1
    },
    "vertical": {"type": "string", "minLength": 1},
    "bands": {"type": "array", "items": {"type": "object"}},
    "dimensions": {"type": "array", "items": {"type": "object"}},
    "controls": {
      "type": "array",
      "minItems": 1,
      "items": {
        "type": "object",
        "required": [
          "id",
          "weight"
        ],
        "properties": {
          "id": {
            "type": "string",
            "minLength": 1
          },
          "weight": {
            "type": "number",
            "minimum": 0,
            "maximum": 1
          }
        },
        "additionalProperties": false
      }
    }
  },
  "additionalProperties": false
}
